Class,Title,Description,BodyText,ImageSrc,ImageSrc2,Caption,Caption2,Link,Keywords
left,In Love With The World (2021),Anicka Yi,"Anicka Yi’s In Love With The World, commissioned for Tate Modern reimagines physical computing not as a tool for control or efficiency, but as a specuulative, sensorial and poetic exploration of machine life, embodiment and ecological entanglement.Yi populates the vast industrial space with floating, autonomous entities she calls aerobes- two species of helium-filled, AI-driven aerial creatures: the xenojellies, translucent and tentacled, and the planulae, bulbous forms covered in yellow hair. These aerobes drift through the air, guided by rotors and sensors, responding to environmental stimuli such as heat signatures from visitors. Their movements are unpredictable yet non-colliding, evoking a sense of life and agency. 
Yi challenges conventional notions of AI by introducing the concept of physical intelligence- the idea that intelligence can emerge from sensory and bodily interactions with the environment, rather than solely from cognitive processes. The aerobes, through their embodied behaviors and interactions, prompt questions about machine learning, autonomy, and the potential for non-human entities to develop their own experiences of the world. 

The installation invites reflection on how we might share our world with autonomous machines and what forms of communication and understanding could emerge from such interactions.",https://artmap.com/static/media/0000140000/0000139619.jpg,,"In Love with the World (Installation View), Tate Modern, Anicka Yi, 2018",,https://www.anickayistudio.biz/exhibitions/in-love-with-the-world,"Physical Intelligence, Sensorial Art, Ecological Embodiment"
leftDoubleImage,A-POC (1998 - Ongoing),Issey Miyake,"Issey Miyake’s A-POC (A Piece of Cloth) reimagines interactivity through fabric, rather than interface. Developed with textile engineer Dai Fujiwara in 1998, A-POC consists of machine-knitted fabric tubes embedded with outlines of garments, which the wearer cuts out and completes themselves. The technology behind it is subtle, one that positions the body as a site of authorship, and clothing as something that emerges through participation, not just consumption.

It invites touch, decision-making, and physical intervention. In that sense, it behaves more like a program than a textile. The user interprets, edits, executes, and what results is never entirely predictable.

A-POC resists the dominant narrative of innovation as sleek, digital, or sensor-driven, but technology is any system or tool that extends human capability. It reframes technology as something slow, open-ended, and embodied.

The work also raises questions about labour and authorship. Who finishes the garment? Who shapes it? It’s not just mass customisation, but rather shared construction. It makes space for imperfection, for personalisation, for garments to carry the imprint of the user’s hand.

A-POC doesn’t claim to be interactive in the digital sense. But its interactivity is no less real. It centres the act of making, offering a kind of tactile programming where the outcome is shaped not by code, but by cut, gesture, and choice.",https://www.researchgate.net/profile/Angela-Finn/publication/42581349/figure/fig10/AS:340494216384534@1458191555666/A-POC-By-Issey-Miyake-1999-An-overview-of-the-creation-of-an-outfi-t-from-the-tube-of.png,https://collectionapi.metmuseum.org/api/collection/v1/iiif/185792/preview, A-POC. By Issey Miyake (1999),"A-POC, Issey Miyake, The Met, 1999",https://www.showstudio.com/news/issey-miyakes-innovative-spirit-lives-on-with-a-poc-able,"Collaborative Technology, Generative Creation, Conscious Design"
leftDoubleImage,Robot Meme (2001),Tokujin Yoshioka,"The 2001 exhibition Robot Meme at Tokyo’s Miraikan (National Museum of Emerging Science and Innovation) proposed a subtle but radical shift: robots not as tools or threats, but as cultural mirrors, entities that reflect and transmit the values, anxieties, and aesthetics of the societies that create them.

Framed around the idea of the “meme”, the exhibition treated robots as carriers of cultural information, or replicators of human ideas, gestures, and desires. It was about asking what robots mean, and why we feel so much when we look at them.

One installation, Cyclops, was a towering robot with a flexible spine of spherical joints and an unblinking camera eye. It swayed gently, tracking visitors with its gaze. The effect was both tender and unsettling, a mechanical being that watched without judgment, evoking questions about surveillance, presence, and what it means to be seen.

P-noir, by contrast, was a delicate, music-box-like robot that danced on command. Visitors could manipulate its movements and expressions through an interface, turning it into a kind of emotional puppet. It invited interaction, but also highlighted the asymmetry of control of who was performing for whom.

Then there was Orchisoid, a hybrid of orchid and machine. It measured the bioelectric currents of living plants, translating their subtle responses to environmental changes into robotic movement. Here, the robot wasn’t mimicking life, but rather blurring the line between organism and mechanism.

Together, these works reframed robotics as a cultural practice, not just a technical one. They suggested that robots are shaped as much by our myths and metaphors as by our engineering. In doing so, Robot Meme opened up a space to consider not just what robots do, but what they signify and what they reveal about us.",https://www.miraikan.jst.go.jp/en/exhibitions/spexhibition/images/robot-meme_slider01.jpg,https://www.miraikan.jst.go.jp/en/exhibitions/spexhibition/images/robot-meme_slider02.jpg,"Robot Meme (Installation View), Tokujin Yoshioka, Miraikan, 2001","Robot Meme (Installation View), Tokujin Yoshioka, Miraikan, 2001",https://www.miraikan.jst.go.jp/en/exhibitions/spexhibition/robot-meme.html,"Cultural Transmission, Robotic Emotion, Media Theory"
left,Blinds (2024),Martin Margiela,"Martin Margiela’s Blinds (2024) stands quietly in Antwerp’s Schuttershofstraat, a cylindrical sculpture composed of vertical slats, reminiscent of window blinds. Crafted from stainless steel, sanded to mimic the softness of fabric, and plated with palladium.

Positioned amid luxury boutiques and heavy foot traffic, Blinds invites contemplation rather than interaction. Unlike the responsive technologies that populate modern urban spaces- motion sensors, facial recognition, smart devices, this installation remains static, offering no feedback or engagement. Its stillness contrasts sharply with the dynamic environment, prompting viewers to consider their role as observers and the nature of visibility in public spaces.

The sculpture echoes themes of concealment and revelation, drawing inspiration from Belgian surrealism and artists like René Magritte, who famously stated, ""Everything we see hides another thing."" As individuals circle Blinds, attempting to glimpse what lies behind, they find only their reflections, emphasizing the perpetual interplay between seen and unseen. 

In an era dominated by ""always-on"" technology and constant connectivity, Blinds serves as a counterpoint, a silent, unresponsive presence that challenges the expectation of interaction. It encourages a moment of introspection, urging passersby to reflect on the pervasive nature of surveillance and the value of privacy in contemporary society.","https://images.e-flux-systems.com/640486_ca04754384b0e1c099efb56753305cb4.jpg,1600",,"Blinds, Martin Margiela, 2024",,https://www.e-flux.com/announcements/640486/martin-margiela-blinds/,"Surveillance Critique, Anti-Interaction, Public Privacy"