Class,Title,Description,BodyText,ImageSrc,ImageSrc2,Caption,Caption2,Link,Keywords
leftDoubleImage,My Best Thing (2011),Frances Stark,"Frances Stark’s My Best Thing began as a series of webcam encounters on Chatroulette. What emerged was a work about sex, but also about art, anxiety, miscommunication, authorship, and the strange intimacy of talking to strangers online. Using free animation software and default “Adam and Eve” avatars, Stark transforms text-chat transcripts into something that’s simultaneously ridiculous and disarmingly honest. The software is generic, but the dialogue is specific, full of insecurity, ego, self-consciousness, and play.The voices are robotic. The avatars are clunky. But the conversations move fast- sometimes into philosophy, sometimes into personal confession, sometimes into nothing at all.

What’s interesting is how Stark doesn’t try to clean any of it up. The awkwardness stays. The humour stays. The misunderstandings, the language gaps, the lag between emotional expression and digital delivery are all part of the work. And yet, despite all that friction, something resembling connection starts to form. These were originally sex-based chats, but they grow into collaborative exchanges about dancehall, Rancière, political unrest, and what it even means to make art in a world saturated with content.

The internet here, isn’t treated as a problem to be solved or a space to escape. It’s taken seriously, even in its messiest forms, as a site of creative and social possibility. What Stark captures isn’t idealism, but potential- how even the most disposable platforms might, under the right conditions, allow something real to emerge.",https://images.squarespace-cdn.com/content/v1/56eb27558a65e2c2a033b13c/1459442286756-Z6RHLGEPSHUOYWFEXOMR/MyBestThing_FrancesStark_NTP.jpg?format=1000w,https://cdn.sanity.io/images/znss6j8p/production/5e81de03efa92a43d3e68d91ebbfd06b93f2e492-1280x720.jpg?w=1920&h=1080&q=55&fit=crop&crop=entropy&auto=format&dpr=2,,"My Best Thing, Frances Stark, Tate Modern, 2011",https://www.tate.org.uk/art/artworks/stark-my-best-thing-t14683,"WebArt, Digital Curation, Digital Surveillanve"
left,Loewe Pixel Hoodie (2023),"Loewe,  Jonathan Anderson","The Loewe pixel hoodie plays with perception in a way that feels quietly sharp. Its jagged edges and blocky shading suggest a digital glitch or low-resolution rendering, something seen on a screen before it's seen on a body. What’s striking is that it doesn’t use digital technology; it simply mimics its language. In doing so, it calls attention to how much of fashion now lives as image, flattened, filtered, and shared.

It’s a garment designed for the gaze of a digitised world, where clothes are more likely to be encountered in lookbooks, livestreams, or posts than in person. The garment plays with this shift, turning the aesthetic of compression into craft. But it also hints at something more: a tension between appearance and substance, between seeing and touching, between the image of fashion and its material reality.

There is also something about the irony of labor here. The hoodie is painstakingly constructed to resemble something made cheaply or automatically. It reflects how digital culture collapses distinctions between the precious and the disposable, the crafted and the virtual.

While Loewe doesn’t offer an intended interpretation of any kind, they intentionally invite viewers to second guess what they are looking at, and by extension,  how you’re using to seeing. It prompts a recalibration of visual habits shaped by screens and our modern day digital landscape.",https://www.highsnobiety.com/static-assets/dato/1664549368-loewe-fw22-collection-paris-pixel-hoodie-dress-1.jpg,,"Loewe Pixel Hoodie, SS23",,https://www.highsnobiety.com/static-assets/dato/1664549368-loewe-fw22-collection-paris-pixel-hoodie-dress-1.jpg,"Digital Aeshetics, Image Culture, WWW"
leftDoubleImage,9 Eyes of Google Street View (2008 - Ongoing),Jon Rafman,"9 Eyes of Google Street View is an ongoing project by Jon Rafman, built entirely from images taken by the nine-lens camera systems mounted on Google’s mapping cars. These photographs aren’t composed in the traditional sense; no framing, no decisive moment, yet Rafman treats them like something worth collecting. His role isn’t to capture, but to select, notice and curate.

What makes the project compelling is how it treats a utilitarian tool; Street View as a sprawling archive of accidental documentation. The images weren’t taken for aesthetic purposes, but Rafman’s selections hint at stories: a man mid-fall, a figure lying alone under an overpass, people staring directly into the lens without knowing what it is. There’s an eerie neutrality to the camera, but the moments Rafman surfaces feel charged.

There’s also a tension between what the technology records and what we’re trained to see. The camera captures everything equally, without intention. But our gaze isn’t neutral. We assign meaning, pattern, mood. Rafman uses this to explore how much human attention still matters, even when images are generated by machines.

Rather than making a clear argument about surveillance or data collection, the work lingers in ambiguity. It reflects on what it means to look, to interpret, and to assign value to images that were never meant to be seen twice. In that way, it sits quietly inside the ethics of vision in a world already over-documented.","https://d1v7jayx2s9clc.cloudfront.net/user/pages/9-eyes/Monzenmachi%20Dori,%20Nagoya,%20Aichi%20Prefecture,%20Japan.jpg",https://s.yimg.com/ny/api/res/1.2/IcnQ7TxFicMVoIT8_LGfIg--/YXBwaWQ9aGlnaGxhbmRlcjt3PTEyMDA7aD02NzU-/https://media.zenfs.com/en/digital_camera_world_590/ad9bc6f3ad7f3ab210ef9d354ffb0eed,"Google Street View Capture, 2009","Google Street View Capture, 2004",https://9-eyes.com/,"Algorithmic Photography, Digital Curation, Surveillance"
leftDoubleImage,Evidence Locker (2004),Jill Magid,"Evidence Locker is a video-based project by Jill Magid, made during a residency with Liverpool’s city-wide CCTV system. The project uses the infrastructure of public surveillance, normally impersonal, anonymous, and opaque as a space for something intimate. Magid dressed in bright red to be easily tracked by camera operators, and later submitted formal footage requests using “Subject Access Requests.” These requests took the form of handwritten letters, part legal, part poetic, often addressed directly to the surveillance workers themselves.

The result is a strange interplay between systems of observation and personal expression. The footage itself is uneventful- walking down streets, pausing at corners, but the framework around it creates tension. Magid isn’t resisting the gaze, but offering herself to it, on her own terms. But the system doesn’t change in response. It stays rigid, procedural.

There’s something quietly disarming about watching someone willingly step into a space designed to monitor without consent. By engaging with the bureaucracy, Magid reveals how surveillance systems rely on a kind of emotional distance. 

Rather than taking a clear stance for or against surveillance, Evidence Locker asks what happens when intimacy is inserted into systems that were built to eliminate it. It doesn’t resolve that tension, but it makes it visible.",https://www.jillmagid.com/uploads/images/scaled/slide_image/29,https://www.jillmagid.com/uploads/images/scaled/slide_image/31,Evidence Locker. Control Room (video still). Digital video. 7:14 min. 2004,Evidence Locker. Control Room. Two-channel digital video. 10 min loop. Installation at Tate Liverpool. 2004,https://www.jillmagid.com/projects/evidence-locker-2,"Bureaucracy, Self Observation, Digital Surveillance"
leftDoubleImage,AUTONOMOUS TRAP 001 (2017),James Bridle,"Autonomous Trap 001 is a minimal but revealing intervention by James Bridle. A salt circle is poured on the ground, broken only by a dashed outer ring. In the centre sits a self-driving car, completely still. Nothing is physically holding it there, but it refuses to move. The car’s sensors interpret the salt as a boundary, something it should not cross, and so it stays put. What Bridle sets up is not a technical failure, but a scenario where the system’s rules prevent it from acting.

The piece works because of its simplicity. A low-tech gesture quietly overrides a complex, intelligent machine. It feels absurd at first, almost like a prank, but the implications run deeper. The car’s paralysis reveals something fragile about systems we are told are advanced or autonomous. When faced with an unfamiliar input, the machine has no capacity for interpretation. It can only follow the instructions it was built on.

Bridle often explores the limits of machine reasoning and the opacity of systems we rely on without fully understanding. This piece doesn’t announce itself as a warning, but it opens space to reflect on how power is coded into technology. It also raises questions about human responsibility. Who defines the logic these machines operate within, and what happens when that logic encounters the unknown?",https://images.squarespace-cdn.com/content/v1/5dc192d42e6f762c2859d5cf/858342f5-745c-483c-989f-889bfdaab7c8/James+Bridle+-+Autonomous+Trap+001+-+credit+James+Bridle.jpeg?format=2500w,https://jamesbridle.com/media/pages/works/autonomous-trap-001/531f8cea09-1680515122/autonomous-trap-001-002.jpg,"Autonomous Trap 001, James Bridle, Performance of a salt circle trap, Mount Parnassus, 14/3/17.","Autonomous Trap 001, James Bridle, Performance of a salt circle trap, Mount Parnassus, 14/3/17.",https://jamesbridle.com/works/autonomous-trap-001,"System Logic, Digital Autonomy, #AIFail"
leftDoubleImage,Conditional Design Manifesto (2008),Moniker,"The Conditional Design Manifesto doesn’t read like a set of rules for making images, but more like an attitude or an invitation. Written by design collective Moniker, the manifesto lays out a way of working that favours process over product, systems over outcomes, and participation over control. Rather than aiming for polished final pieces, the focus is on setting up conditions and letting them unfold.

At the centre of this approach is the idea that design can function like a living system. You set the parameters, define a set of rules, and then let the result emerge through repetition, interaction, and time. The process is generative, but it resists the idea of automation. There’s something intentionally lo-fi about it. The outcomes are shaped by hands, pens, and small group dynamics, not just code or computational precision.

The manifesto values constraints, not as limitations, but as starting points. It treats algorithms not as tools for efficiency, but as structures for play and experimentation. In that sense, it mirrors the logic behind many generative systems, where complexity comes not from complexity itself, but from simple rules repeated again and again.",https://dukduk.wordpress.com/wp-content/uploads/2008/11/conditionaldesignmanifesto.png,https://encrypted-tbn0.gstatic.com/images?q=tbn:ANd9GcRZegIfDKCe8RydrCNmWdqSaZjgJrVF5rYAIA&s,"Conditional Design Manifesto, Moniker, 2008","Conditional Design Manifesto, Moniker, 2008",https://conditionaldesign.org/manifesto/,"Generative Drawing, #Rulez, Participation"
leftDoubleImage,Please Change Beliefs (1995),Jenny Holzer,"Please Change Beliefs was an early web-based artwork by Jenny Holzer, first created in 1995 at a time when the internet still felt new, raw, and open-ended. The piece takes Holzer’s iconic Truisms; short, loaded statements like “Abuse of power comes as no surprise” and feeds them into an interactive form. Visitors can read the statements, respond to them, or submit their own, creating a loop between fixed language and user-driven input. It’s simple in structure, but what it’s asking is complicated.

The work foregrounds the instability of meaning. Holzer’s texts have always operated like that- short enough to feel true, contradictory enough to make you question why. In this context, they become prompts for reflection, argument, or projection. There’s no right way to interact with them, but you’re not passive either. The piece recognises that meaning is shaped through repetition, reaction, and collective response.

It also feels very much rooted in the early ethos of the web, as a space where authorship could be shared, where systems could be reprogrammed or responded to directly. There’s a democratic impulse running through it, but not an idealistic one. It’s more about testing the limits of control, watching how language moves when it’s placed into circulation.","https://walker-web.imgix.net/cms/Screen-Shot-2015-08-06-at-4.07.54-PM-1.png?auto=format,compress&w=1920&h=1200&fit=crop&dpr=1.5",https://lh3.googleusercontent.com/proxy/xS_eQVXpPQyh0Zt-rQ4RP9_6Qd4HYPvTPEuFdOQ4v6pddfZrtgAJ-PyfeYvuCtwjeBtRJuMrjpe5Bbk1E2CBPyrEKqEg8rPlHrwzubYKZPOMrwI,,"Please Change Beliefs, Jenny Holzer, 1995",http://adaweb.walkerart.org/project/holzer/cgi/pcb.cgi,"Web Art, Collective Authorshop, Truisms"
leftDoubleImage,Grapefruit (1964),Yoko Ono,"Grapefruit, first published in 1964, is a collection of instructional texts by Yoko Ono. Each one reads like a poetic prompt or absurd directive: “Imagine letting a goldfish swim across the sky” or “Draw a map to get lost.” Some are playful, others are strangely moving, but all of them invite the reader to participate. Not by completing a task in a strict sense, but by entering into the space the instruction opens up.

The work operates through suggestion rather than prescription. Ono doesn’t tell you what to think, and the instructions often resist any practical execution. But that’s part of their strength. They are scores for the imagination, built from minimal language, where the outcome is not the point. The instruction is both the work and the invitation.

There’s a clear connection here to rule-based systems, but in a very loose, human sense. These aren’t algorithms in the computational way, but they are formulaic. Each one sets a condition and waits for the reader to activate it. That activation might happen internally, or through gesture, or not at all.

What’s especially compelling is how Grapefruit anticipates participatory and conceptual practices that came decades later. It treats the audience as a co-author and language as a generative material. The work is deeply personal but built from shared structures. Even now, it feels contemporary in how it leaves space for uncertainty, misreading, or drift.",https://www.moma.org/media/W1siZiIsIjM0NjM0MiJdLFsicCIsImNvbnZlcnQiLCItcXVhbGl0eSA5MCAtcmVzaXplIDIwMDB4MTQ0MFx1MDAzZSJdXQ.jpg?sha=ee73ba057e53da3e,https://www.on-curating.org/files/oc/dateiverwaltung/Issue51/14_Fluxus_Concannon_K%20Touch%20Piece/11.-GrapefruitPages_page_212_TouchPoemV-copy.jpg,,"Grapefruit, Yoko Ono, 1964",https://www.moma.org/collection/works/128103,"Instruction Art, Participation,  Absurdity"
left,Comme Des Garcons (1969 - Ongoing),Rei Kawakubo,"Rei Kawakubo’s design process at Comme des Garçons begins with a single word. Not a theme or a mood board, but a prompt- abstract, open-ended, and deliberately ambiguous. Words like “invisible,” “absence,” or “not making clothes” serve as starting points, not directives. From there, her team of patternmakers interprets the prompt individually, each creating forms that respond to it in their own way. These initial pieces are then brought together, not to select a winner, but to observe what emerges collectively. The process is iterative, with garments evolving through discussion, adjustment, and reworking.

This method treats design as a system of generative constraints. The prompt acts as a seed, the patternmakers as agents within a set of rules, and the final collection as an emergent property of the system. It’s a human algorithm, where the variables are intuition, experience, and interpretation. The outcome is not predetermined, but discovered through the process.

What’s compelling is how this process mirrors broader themes in generative and rule-based art. It embraces uncertainty, values process over product, and sees constraints not as limitations, but as opportunities for exploration. In doing so, Kawakubo redefines what it means to design, shifting the focus from the individual creator to the system of creation itself.",https://assets.vogue.com/photos/55d7a210a29b3c331d148b80/master/w_1280%2Cc_limit/COMME-DES-GARCONS-SPRING-1997-RTW-08.jpg,,"Comme des Garcons Spring 1997, Rei Kawakubo",,https://www.vogue.com/fashion-shows/spring-1997-ready-to-wear/comme-des-garcons,"Generative Co-creation, Collective Authorship, Process over Outcome"
leftDoubleImage,Smell Dating (2016),Tega Brain & Betabook,"Smell Dating is a collaboration between artist-engineer Tega Brain and media collective Betabook, and it does something oddly simple: it matches people not by photographs, bios, or shared interests, but by smell. Participants wear a plain cotton T-shirt for three days without deodorant, then mail it in. The shirts are redistributed anonymously, and participants choose who they’d like to date based solely on scent. If there’s a mutual match, the pair is connected.

The project plays with the language and structure of dating apps but replaces data with biology. It takes something ancient and embodied; smell, and places it at the centre of a system that typically flattens attraction into swipeable profiles and predictive algorithms. The matching process is still rule-based, still systematised, but the criteria are completely outside the logic of metrics and machine learning.

What’s interesting here is how the project resists optimisation. There’s no “better” smell, no algorithm that improves over time. Instead, Smell Dating asks what happens when you trust something intuitive, even animal, inside a framework designed to be efficient and clean. It disrupts the normal flow of information, replacing visible data with something that can’t be quantified or browsed.",https://freight.cargo.site/w/1920/q/75/i/84f4cbc6b93005bd6101279caf0db1d7df0c89973a249c1ec1019ff027f3fed1/SS-4.jpg,https://freight.cargo.site/w/2000/q/75/i/9bccc519bba81fbef883301758d3cb10f59a41d18a3e7d129f98c6ae41128955/IMG_7240.jpg,"
Exhibition view, ‘Smell Dating,’ New York, 2016","Exhibition view, ‘Smell Dating,’ Shanghai, 2016. Photo: Tega Brain",https://tegabrain.com/Smell-Dating,"Sensory Experiential Design, Natural algorithms, #Pheremones"
leftDoubleImage,Work No. 227 (2000),Martin Creed,"Work No. 227: The lights going on and off is an installation by Martin Creed that consists of an empty gallery space where the lights switch on and off at five-second intervals. There is no object to observe, no image to interpret, just the room itself, alternating between illumination and darkness.

The piece challenges traditional expectations of art by removing visual content and focusing on the viewer's experience within the space. The shifting light conditions heighten awareness of the room's architecture, the presence of others, and one's own body. This cyclical pattern creates a rhythm that is both predictable and unsettling, prompting reflection on the passage of time and the nature of perception.

Creed's work aligns with minimalist and conceptual art traditions, emphasizing ideas over material form. By using the existing infrastructure of the gallery; its lights and space, he transforms the environment into the artwork itself. This approach invites viewers to consider the boundaries of art and the role of context in shaping experience.

The simplicity of Work No. 227 engages the audience in a dialogue about presence, absence, and the act of observation. The installation becomes a meditation on the interplay between light and dark, presence and void, challenging viewers to find meaning in the most fundamental elements of experience.",https://www.kidspiritonline.com/wp-content/uploads/2021/08/fZWm6KMzSCeNPHJPnaeX_23191-842.jpg,https://i.pinimg.com/736x/9a/37/0d/9a370d4d795b5c03a5a976e1d30cc253.jpg,"Lights off Installaion View, Work No. 227, Martin Creed, Tate, 2000","Lights on Installaion View, Work No. 227, Martin Creed, Tate, 2000",https://www.tate.org.uk/art/artworks/creed-work-no-227-the-lights-going-on-and-off-t13868,"Time based Art, Generative Systems, Minimalism"
left,Supplement to the Italian Dictionary (1963),Bruno Munari,"Bruno Munari’s Supplement to the Italian Dictionary (1963) is a visual catalogue of hand gestures. It presents a series of photographs, each showing an isolated gesture along with a short caption explaining its meaning or use. The collection is framed as a satirical addition to a formal dictionary, but its tone isn’t mocking. If anything, it feels like a sincere recognition of a language that exists parallel to speech, one that’s learned intuitively and used constantly, but rarely written down.

There’s something here that overlaps with the logic of generative systems. The gestures are modular, discrete, each carrying a specific function, yet when placed side by side, they hint at an open-ended language that evolves through use. The book reads like a human algorithm: input a hand shape, output a social cue.

Even in its simplicity, the work draws attention to how meaning is constructed through repetition, form, and shared understanding- it’s systematic, but lived. A kind of code that’s constantly running beneath speech.",https://shop.heide.com.au/cdn/shop/files/supplementposter.png?v=1729739139,,"Supplement to the Italian Dictionary (Excerpt), Bruno Munari, 1963",,https://corraini.com/en/supplement-to-the-italian-dictionary.html,"Gesture Language, Visual Instruction, Cultural Systems"
left,Harlow's Studies (1950s - 1960s),Harry Harlow,"In the 1950s and 60s, psychologist Harry Harlow carried out a series of studies on rhesus monkeys to understand early emotional development. The setup included infant monkeys who were removed from their mothers and given two surrogates. One was made of cold, bare wire but dispensed milk. The other, covered in soft cloth, offered no nourishment at all. Despite this, the monkeys consistently chose the cloth surrogate, clinging to it for comfort even though it couldn’t feed them. The results showed that when given a choice, they preferred warmth, softness, and the illusion of care over functionality.

Harlow’s work challenges us to consider what humans (or animals) truly want from interactive systems. His monkeys did not gravitate toward the machine that “performed” a task (feeding), but the one that felt alive, offering warmth, perceived protection, and contact. In a world increasingly filled with robotic pets, AI companions, and emotionally expressive interfaces, these early surrogates forecast a critical question: Is affective interaction about intelligence, or about form, vulnerability, and presence?

Ultimately, these studies underscore the tension at the heart of emotional computing: between real connection and the simulation of it, between care and its technological stand-ins.",https://media.sciencephoto.com/g3/52/04/06/g3520406-800px-wm.jpg,,"Harlow's Monkey Experiment, Harry Harlow, Year unknown",,http://en.wikipedia.org/wiki/Harry_Harlow,"Speculative Prototypes, Human & Machine, AI Attachment"
left,Caress (2018) ,Pfeifer & Kreutzer,"In their kinetic sculptures, artist duo Pfeifer & Kreutzer build machines that perform care; mechanically, precisely, and without emotion. Mechanical wiper arms move in slow repetition across a surface of faux fur. The gesture is recognisable: stroking, caressing, maybe even comforting, but it’s also uncanny. There are no sensors, feedback, or response. The machine does not adjust or attend, but just repeats, asking what happens when the movements of intimacy are stripped of agency, warmth, and reciprocity.

The use of motorized touch here becomes deeply ambiguous. On one hand, it mimics comfort, softness, even eroticism; on the other, it evokes discomfort, absurdity, and loss. There’s a haunting quality in the idea of a machine trying (and failing) to replicate emotional labor. The fur caress becomes a metaphor for how gesture can be emptied of meaning under conditions of automation and repetition. These works turn the promise of “smart” interaction on its head: there are no sensors, no inputs, no feedback. 

As contributions to the field of physical computing, Pfeifer & Kreutzer’s works propose a compelling alternative: machines not as tools of control or enhancement, but as slow, strange, and speculative actors, challenging us to confront the emotional infrastructure of our relationships with technology.",https://www.mmiii.de/images/2021/PFEIFER-KREUTZER/MMIII-Kunstverein-2021-PFEIFERKREUTZER-Beruehrung-09.jpg,,"Caress, Pfeifer & Kreutzer, 2018",,https://www.mmiii.de/ausstellungen/2021/pfeifer-kreutzer,"Affective Computing, Kinetic Art, Physical Computation"
